{
  "report_version": "0.1",
  "generated_at": "2026-07-05T00:00:00Z",
  "repository": "rezahh107/example-contract-repo",
  "default_branch": "main",
  "connector_scope": {
    "files": "available",
    "pull_requests": "available",
    "workflow_runs": "unknown",
    "artifacts": "unknown",
    "related_repositories": "not_applicable"
  },
  "inventory": {
    "languages": ["Python", "JSON", "Markdown"],
    "package_files": ["pyproject.toml"],
    "lockfiles": [],
    "test_files": ["tests/test_schema.py"],
    "schema_files": ["schemas/review.schema.json"],
    "validator_files": ["scripts/validate_repository.py"],
    "version_files": ["CURRENT_VERSION"],
    "docs": ["README.md", "AGENTS.md"]
  },
  "workflows": [".github/workflows/validate.yml"],
  "workflow_runs": [],
  "historical_signals": [
    {"source": "commit", "summary": "fixed schema validation regression"}
  ],
  "persian_historical_signals": [],
  "hotspots": [
    {"path": "schemas/review.schema.json", "reason": "schema controls accepted packages"}
  ],
  "cross_repo_evidence": [],
  "limitations": ["workflow run telemetry was not available in this example"],
  "evidence_completeness": {
    "static_inventory": "complete",
    "git_history": "partial",
    "workflow_telemetry": "unavailable",
    "cross_repo": "not_applicable",
    "persian_search": "unknown"
  }
}
